source,title,description,url,publishedAt
"{'id': None, 'name': 'Pypi.org'}",ai-edge-litert-nightly 2.0.4.dev20251013,LiteRT is for mobile and embedded devices.,https://pypi.org/project/ai-edge-litert-nightly/2.0.4.dev20251013/,2025-10-14T06:13:13Z
"{'id': None, 'name': 'Ndtvprofit.com'}",HCLTech Q2 Review: AI Led Growth Drives Record Win And Margin Momentum; IDBI Capital Upgrades Stock To 'Buy',"HCLTech Ltd. delivered a resilient Q2 FY26 performance, registering a 2.4%/4.6% QoQ/YoY revenue expansion in CC term, underpinned by broad-based momentum across IT, Business, and Engineering Services. Operating margin strengthened to 17.5%, reflecting improve…",https://www.ndtvprofit.com/research-reports/hcltech-q2-review-ai-led-growth-drives-record-win-and-margin-momentum-idbi-capital-upgrades-stock-to-buy,2025-10-14T06:13:11Z
"{'id': None, 'name': 'Independent.ie'}",The Big Tech Show: How to use Chat GPT for total beginners,What are the best tips for beginners using AI chat bots? Have AI videos featuring dead celebrities gone too far? And is the EU losing the tech race because of stringent regulations?,https://www.independent.ie/podcasts/the-big-tech-show/the-big-tech-show-how-to-use-chat-gpt-for-total-beginners/a1181924405.html,2025-10-14T06:13:03Z
"{'id': None, 'name': 'Realstorygroup.com'}",Time to Reconsider Your CMS Platform?,I’m very excited on your behalf about the next phase of enterprise customer content management,https://www.realstorygroup.com/Blog/time-reconsider-your-cms-platform,2025-10-14T06:11:11Z
"{'id': None, 'name': 'Yahoo Entertainment'}",Google says to invest $15 billion in AI data centre capacity in India's Andhra,,https://consent.yahoo.com/v2/collectConsent?sessionId=1_cc-session_d976f3d7-714f-4585-8e42-85a65c921ce8,2025-10-14T06:10:41Z
"{'id': None, 'name': 'PCMag.com'}",HP Rolls Out AI-Powered Tools to Simplify Hybrid Work at Gitex 2025,"New displays, a proximity-aware dock, an AI development desktop, and expanded WXP remote support headline HP’s 14-item push into future-ready work.",https://me.pcmag.com/en/laptops/32869/hp-rolls-out-ai-powered-tools-to-simplify-hybrid-work-at-gitex-2025,2025-10-14T06:10:23Z
"{'id': 'rte', 'name': 'RTE'}",What could burst the AI bubble?,"As tech firms soar in value, there are now warnings of a possible rapid correction due to concerns about how realistic such valuations actually are",https://www.rte.ie/brainstorm/2025/1014/1538409-ai-tech-firms-valuations-bubble-open-ai-anthropic/,2025-10-14T06:10:06Z
"{'id': 'rte', 'name': 'RTE'}",Fall in job openings in third quarter - Morgan McKinley,"Professional job openings fell by 3% in the third quarter of 2025 compared with both the previous quarter and the same period last year, according to the latest Morgan McKinley Irish Employment Monitor.",https://www.rte.ie/news/business/2025/1014/1538414-morgan-mckinley-irish-employment-monitor/,2025-10-14T06:09:50Z
"{'id': None, 'name': 'PhoneArena'}","Miraculously, the Pixel 9 is now cheaper than it was on Prime Day","It's not every day you get to save a whopping $254 on one of the best Google Pixel phones, right?",https://www.phonearena.com/news/pixel-9-cheaper-than-on-prime-day_id174856,2025-10-14T06:09:36Z
"{'id': None, 'name': 'CNBC'}",Google to invest $10 billion in AI data center project in India,"Google plans to invest $10 billion into data center and AI infrastructure in Southern India, according to local officials.",https://www.cnbc.com/2025/10/14/google-to-invest-10-billion-in-ai-data-center-project-in-india.html,2025-10-14T06:08:54Z
"{'id': None, 'name': 'Streamingmedia.com'}","As AI Personalizes the Future, Local Ads Must Break Free from One-Size-Fits-All","As AI embeds itself deeper into the infrastructure of modern advertising, it's changing how we think about developing and tailoring the message itself. Ad creative can be dynamic, testable, and just as targeted as the rest of the campaign.",https://www.streamingmedia.com/Articles/ReadArticle.aspx?ArticleID=171895,2025-10-14T06:05:10Z
"{'id': None, 'name': 'Biztoc.com'}",Mastercard Earnings Preview: What to Expect,,https://biztoc.com/x/01194690c73373c7,2025-10-14T06:04:55Z
"{'id': None, 'name': 'Biztoc.com'}",Davidson Kempner Joins the Rush of Hedge Funds to Abu Dhabi,,https://biztoc.com/x/264c9254fa62ddf8,2025-10-14T06:04:50Z
"{'id': 'the-times-of-india', 'name': 'The Times of India'}","Thane: Shiv Sena (UBT), MNS vow to end ‘Ravan raj’ in civic bodies, accuse officials of corruption, mismanagement",Shiv Sena (UBT) and MNS leaders have united to combat corruption in Thane's civic bodies. They allege that funds meant for development have vanished and that officials are colluding with mafias. The parties promise to end misrule and establish good governance…,https://timesofindia.indiatimes.com/city/thane/thane-shiv-sena-ubt-mns-vow-to-end-ravan-raj-in-civic-bodies-accuse-officials-of-corruption-mismanagement/articleshow/124545070.cms,2025-10-14T06:01:18Z
"{'id': None, 'name': 'SiliconANGLE News'}",Research hub Wiley launches platform to enable scientific discovery with AI,Authoritative science content and research intelligence hub John Wiley & Sons Inc. said today it’s launching an artificial intelligence-native platform that provides researchers access to trusted peer-reviewed papers and articles from scholarly publications. …,https://siliconangle.com/2025/10/14/research-hub-wiley-launches-platform-enable-scientific-discovery-ai/,2025-10-14T06:00:37Z
"{'id': None, 'name': 'Marketing Week'}",From memes to taking on TV: Inside YouTube’s 20-year evolution,"Celebrating its 20th anniversary, YouTube claims to be solidifying its position as a TV challenger, creator hub and ""first place"" for brand marketing.
Source",https://www.marketingweek.com/youtube-20-years-creators-brands/,2025-10-14T06:00:28Z
"{'id': None, 'name': 'TheJournal.ie'}",Opinion: Using AI for art will hollow out what it means to be human,"The rise of AI risks turning us into consumers instead of creators, writes Emma DeSouza.",https://www.thejournal.ie/readme/ai-for-art-loses-human-creativity-opinion-emma-desouza-6843342-Oct2025/,2025-10-14T06:00:22Z
"{'id': None, 'name': 'Streamingmedia.com'}",Ad Week NY: BrightLine CEO and Founder Jacqueline Corbelli Discusses Her Framework for Transforming Ambitious Ideas into Practical Outcomes,"At this year's Advertising Week New York, Corbelli sat down for a Q&A with Michael Gewirtzman, the Global VP of Programming at Advertising Week. In the interview, she explained her framework for transforming ambitious ideas into practical outcomes and how any…",https://www.streamingmedia.com/Articles/ReadArticle.aspx?ArticleID=171893,2025-10-14T06:00:20Z
"{'id': None, 'name': 'Prtimes.jp'}",リーガルテック社、経営に活かす『戦略知財AI』モデルを構築,"[リーガルテック株式会社]
[画像: https://prcdn.freetls.fastly.net/release_image/42056/337/42056-337-ecf7068117879bca3aab47e539ba5680-1999x1231.jpg?width=536&quality=85%2C75&format=jpeg&auto=webp&fit=bounds&a...",https://prtimes.jp/main/html/rd/p/000000337.000042056.html,2025-10-14T06:00:00Z
"{'id': None, 'name': 'Creative Bloq'}",Could DC Comics' anti-AI stance mark a tide change against AI slop?,"""We recoil from what feels fake,"" the comic publisher's president says.",https://www.creativebloq.com/ai/ai-art/could-dc-comics-anti-ai-stance-mark-a-tide-change-against-ai-slop,2025-10-14T06:00:00Z
"{'id': None, 'name': 'Adweek'}",Topsort Wins Retail Media Business for Food Delivery Platform Just Eat Takeaway.com,The Netherlands-based company was just acquired by investment firm Prosus.,https://www.adweek.com/commerce/topsort-wins-retail-media-business-for-food-delivery-platform-just-eat-takeawaycom/,2025-10-14T06:00:00Z
"{'id': None, 'name': 'GlobeNewswire'}",Helvetic Broker Launches on App Store and Play Store to Make Crypto Management Safe and Simple,"Lausanne, Switzerland , Oct. 14, 2025 (GLOBE NEWSWIRE) -- Helvetic Broker, an AI-powered self-custody crypto application, has become available on the App Store and Play Store. A team of Swiss engineers has been building the app since 2023 to democratize crypt…",https://www.globenewswire.com/news-release/2025/10/14/3165883/0/en/Helvetic-Broker-Launches-on-App-Store-and-Play-Store-to-Make-Crypto-Management-Safe-and-Simple.html,2025-10-14T06:00:00Z
"{'id': None, 'name': 'GlobeNewswire'}","Smartwatch Market Size to Surpass USD 79.57 Billion by 2033, at 12.08% CAGR | Research by SNS Insider","Smartwatch Market growth is driven by rising health & fitness tracking needs, smart connectivity (LTE/IoT), growing demand in affordable models, and expanding wearable tech adoption globally. Smartwatch Market growth is driven by rising health & fitness track…",https://www.globenewswire.com/news-release/2025/10/14/3165885/0/en/Smartwatch-Market-Size-to-Surpass-USD-79-57-Billion-by-2033-at-12-08-CAGR-Research-by-SNS-Insider.html,2025-10-14T06:00:00Z
"{'id': None, 'name': 'Naturalnews.com'}",The world awaits the fallout as Nobel Peace Prize once again eludes Trump,"Donald Trump was not awarded the 2025 Nobel Peace Prize, which instead went to Venezuelan opposition leader Maria Corina Machado. Analysts see this as a direct rejection of Trump’s style of diplomacy and his self-proclaimed role as a top peacemaker. Trump’s l…",https://www.naturalnews.com/2025-10-14-world-awaits-fallout-nobel-prize-eludes-trump.html,2025-10-14T06:00:00Z
"{'id': None, 'name': 'Prtimes.jp'}",内部統制業務DX SaaS「smoove J-SOX」、新機能「AIリスクスキャン」を提供開始 ─ リスク検知を生成AIがアシスト ─,"[WARC]
[画像1: https://prcdn.freetls.fastly.net/release_image/38497/81/38497-81-74068a1c22af3698bcb031da6413076f-1920x1280.png?width=536&quality=85%2C75&format=jpeg&auto=webp&fit=bounds&am...",https://prtimes.jp/main/html/rd/p/000000081.000038497.html,2025-10-14T06:00:00Z
"{'id': None, 'name': 'Naturalnews.com'}","AI breakthrough detects hidden hardware trojans, exposing a critical flaw in the global chip supply chain","In an era where every piece of technology, from our smartphones to life-saving medical devices, is powered by computer chips, a hidden vulnerability threatens the very foundation of our digital world. These are not software bugs that can be patched with an up…",https://www.naturalnews.com/2025-10-14-ai-breakthrough-detects-hidden-hardware-trojans.html,2025-10-14T06:00:00Z
"{'id': None, 'name': 'Naturalnews.com'}",Free AI model “Enoch” released to combat global censorship and monopolistic control,"Decentralized Knowledge Tool: Mike Adams launches “Enoch,” a 12B-parameter AI model trained on 100M+ pages of alternative health, survival, and historical data, to resist Big Tech/Pharma control and provide uncensored information. Offline Accessibility: Opera…",https://www.naturalnews.com/2025-10-14-free-ai-model-enoch-released.html,2025-10-14T06:00:00Z
"{'id': None, 'name': 'Notebookcheck.net'}",Honor pits Magic 8 Pro against iPhone 17 Pro in high-altitude helicopter nightography test,"The Honor Magic 8 Pro is set to launch as a new Snapdragon 8 Elite Gen 5 flagship that's geared for photography. To showcase how well the phone captures photos at night, the company has put it against the iPhone 17 Pro in a pre-promotional video.",https://www.notebookcheck.net/Honor-pits-Magic-8-Pro-against-iPhone-17-Pro-in-high-altitude-helicopter-nightography-test.1138018.0.html,2025-10-14T05:59:00Z
"{'id': None, 'name': 'Digitimes'}","AMD CTO projects US$500 billion AI market by 2028, calls openness 'fundamental' for scale","Open collaboration and shared standards will be essential to sustain the exponential growth of artificial intelligence (AI), AMD Chief Technology Officer and Executive Vice President Mark Papermaster said at the 2025 OCP Global Summit.",https://www.digitimes.com/news/a20251014VL204/amd-ai-gpu-design-2028.html,2025-10-14T05:58:30Z
"{'id': 'ansa', 'name': 'ANSA.it'}","PRIME PAGINE | Tornano i rapiti, i gemelli e il ragazzo pelle-ossa",Pace a Gaza. Trump: ‘Alba storica’. Learn more about your ad choices. Visit megaphone.fm/adchoices (ANSA),https://www.ansa.it/sito/podcast/ansa_voice_daily/2025/10/14/prime-pagine-tornano-i-rapiti-i-gemelli-e-il-ragazzo-pelle-ossa_bf1d2ea5-0a46-4afe-9a44-f8103d9a6744.html,2025-10-14T05:57:31Z
"{'id': 'the-times-of-india', 'name': 'The Times of India'}",Thane Municipal Corporation (TMC) under probe after deputy commissioner’s arrest; officials accused of 'clinging on to lucrative posts',"Elected representatives and activists are questioning Thane Municipal Corporation employees who allegedly remain in lucrative posts for years, bypassing promotions. This trend resurfaced after a deputy commissioner's arrest, sparking demands for scrutiny into…",https://timesofindia.indiatimes.com/city/thane/thane-municipal-corporation-tmc-under-probe-after-deputy-commissioners-arrest-officials-accused-of-clinging-on-to-lucrative-posts/articleshow/124544927.cms,2025-10-14T05:56:49Z
"{'id': 'the-times-of-india', 'name': 'The Times of India'}","Delhi horror: South Asian University student 'sexually assaulted' by security guard, staffer and 2 students","A female student at South Asian University has alleged sexual assault on campus, with a security guard, staff member, and two students reportedly involved. The university has formed a probe committee. Separately, an MBBS student in Adarsh Nagar reported being…",https://timesofindia.indiatimes.com/city/delhi/delhi-horror-south-asian-university-student-sexually-assaulted-by-security-guard-staffer-and-2-students/articleshow/124544710.cms,2025-10-14T05:54:37Z
"{'id': None, 'name': 'Biztoc.com'}","Publicis Lifts Outlook, Says AI Is Boosting Growth",The company raised its outlook for the second time this year after artificial intelligence helped power its top line.,https://biztoc.com/x/26f78009ee4453da,2025-10-14T05:54:12Z
"{'id': None, 'name': 'Biztoc.com'}",CMS Energy Earnings Preview: What to Expect,,https://biztoc.com/x/cd01a9b02fe80f36,2025-10-14T05:54:11Z
"{'id': None, 'name': 'Biztoc.com'}",What to Expect From Bristol-Myers Squibb's Next Quarterly Earnings Report,,https://biztoc.com/x/b77a2c9993d8fcf9,2025-10-14T05:54:01Z
"{'id': None, 'name': 'Biztoc.com'}",Here's What to Expect From Xcel Energy's Next Earnings Report,,https://biztoc.com/x/f413c12ffe9a5f97,2025-10-14T05:53:59Z
"{'id': None, 'name': 'Biztoc.com'}","Greek strike against labour reforms disrupts transport, services",,https://biztoc.com/x/be316d8621062e27,2025-10-14T05:53:57Z
"{'id': None, 'name': 'Biztoc.com'}",Merck & Co. Earnings Preview: What to Expect,,https://biztoc.com/x/555c67ef0b2e38c3,2025-10-14T05:53:48Z
"{'id': None, 'name': 'TechNode'}","Apple CEO Cook debuts iPhone Air Live on TikTok, China launch set for October 22","Apple CEO Tim Cook made a splash in China by appearing in a TikTok Apple Store live stream, announcing the launch of the iPhone Air for the Chinese market. The device will go on sale on October 22, with pre-orders opening on October 17. The iPhone Air, the wo…",http://technode.com/2025/10/14/apple-ceo-cook-debuts-iphone-air-live-on-tiktok-china-launch-set-for-october-22/,2025-10-14T05:52:30Z
"{'id': None, 'name': 'Yahoo Entertainment'}",Capital Allocation Trends At Kelly Partners Group Holdings (ASX:KPG) Aren't Ideal,"Did you know there are some financial metrics that can provide clues of a potential multi-bagger? Firstly, we'll want...",https://finance.yahoo.com/news/capital-allocation-trends-kelly-partners-055154146.html,2025-10-14T05:51:54Z
"{'id': 'the-times-of-india', 'name': 'The Times of India'}",Maharashtra: Uddhav Thackeray says late Sena leader Anant Tare warned him about Eknath Shinde’s ‘betrayal’ in 2014,"Shiv Sena (UBT) chief Uddhav Thackeray revealed he was warned by late leader Anant Tare in 2014 about Eknath Shinde's potential betrayal, a warning he now regrets ignoring. Thackeray also criticized Shinde's alliance with the BJP, predicting his downfall, and…",https://timesofindia.indiatimes.com/city/thane/maharashtra-uddhav-thackeray-says-late-sena-leader-anant-tare-warned-him-about-eknath-shindes-betrayal-in-2014/articleshow/124544737.cms,2025-10-14T05:50:02Z
"{'id': None, 'name': 'Prtimes.jp'}",AI活用で「稼げる米農業」へ。米農家向け無料AIコンサルを提供,"[株式会社農情人]
[画像1: https://prcdn.freetls.fastly.net/release_image/87046/168/87046-168-ab77175778fceffd9353feaf3a71c8cf-1920x1080.png?width=536&quality=85%2C75&format=jpeg&auto=webp&fit=bounds&...",https://prtimes.jp/main/html/rd/p/000000168.000087046.html,2025-10-14T05:49:42Z
"{'id': 'abc-news', 'name': 'ABC News'}",Asian shares are mixed and US futures little changed after Wall St rally,Asian shares are trading mixed after a rally on Wall Street spurred by U.S. President Donald Trump's reassurances over relations with China,https://abcnews.go.com/Business/wireStory/asian-shares-mixed-us-futures-changed-after-wall-126499029,2025-10-14T05:48:58Z
"{'id': None, 'name': 'Github.com'}",GitHub - steveyegge/beads: Beads - A memory upgrade for your coding agent,Beads - A memory upgrade for your coding agent. Contribute to steveyegge/beads development by creating an account on GitHub.,https://github.com/steveyegge/beads,2025-10-14T05:47:01Z
"{'id': None, 'name': 'Foreign Affairs'}",The Coming AI Backlash | Foreign Affairs,How the anger economy will supercharge populism.,https://www.foreignaffairs.com/united-states/coming-ai-backlash,2025-10-14T05:47:01Z
"{'id': 'hacker-news', 'name': 'Hacker News'}",NanoChat – The best ChatGPT that $100 can buy | Hacker News,,https://news.ycombinator.com/item?id=45569350,2025-10-14T05:47:01Z
"{'id': None, 'name': 'Ghost.io'}",Robot Slur Discourse,"We are what we pretend to be, so we must be careful about what we pretend to be.

Kurt Vonnegut

Ah, the kids, they don't yearn for the mines any more, they yearn for the slurs!

@supervilliansprax

A ""Robot Slur"" is a slur for an AI or robot.


I think this …",https://gyges-blog.ghost.io/robot-slur-discourse/,2025-10-14T05:47:01Z
"{'id': None, 'name': 'ComputerWeekly.com'}",Vox pop: Digital transformation across the Arab world,We asked exhibitors at UAE startup event Expand North Star about the challenges – from lack of fundamental infrastructure to first-world problems – faced by startups and digital businesses in the Middle East,https://www.computerweekly.com/news/366632643/Vox-pop-Digital-transformation-across-the-Arab-world,2025-10-14T05:46:00Z
"{'id': None, 'name': 'Madshrimps.be'}",NVIDIA DGX Spark Arrives for World’s AI Developers,"NVIDIA today announced it will start shipping NVIDIA DGX Spark, the world's smallest AI supercomputer. AI workloads are quickly outgrowing the memory and software capabilities of the PCs, workstations and laptops millions of developers rely on today—forcing t…",https://www.madshrimps.be/news/nvidia-dgx-spark-arrives-for-worlds-ai-developers/,2025-10-14T05:45:13Z
"{'id': None, 'name': 'Madshrimps.be'}",MSI to Showcase NVIDIA MGX Servers and EdgeXpert Desktop AI Supercomputer at OCP 2025,"MSI, a global leader in high-performance computing, will showcase its latest AI infrastructure solutions at the OCP Global Summit 2025, held from October 13-16, 2025 at the San Jose Convention Center, California (Booth #A55). The company will debut its NVIDIA…",https://www.madshrimps.be/news/msi-to-showcase-nvidia-mgx-servers-and-edgexpert-desktop-ai-supercomputer-at-ocp-2025/,2025-10-14T05:45:06Z
"{'id': 'the-times-of-india', 'name': 'The Times of India'}",Canada may need India now more than ever as trade risks mount,"Canada is seeking to diversify its trade and strategic partnerships, particularly with India, to mitigate economic pressures from the United States and China. Foreign Minister Anita Anand is leading efforts to strengthen ties with India, focusing on trade, te…",https://economictimes.indiatimes.com/news/economy/foreign-trade/canada-india-trade-relations-us-tariffs-china-anita-anand-jaishankar-modi-mark-carney-economy-investment/articleshow/124543717.cms,2025-10-14T05:43:19Z
"{'id': None, 'name': 'Madshrimps.be'}",ASUS Announces Availability of ASUS Ascent GX10 Personal AI Supercomputer,"ASUS today announced that the new Ascent GX10 will be available on October 15, 2025. This compact and powerful desktop AI supercomputer is designed to make advanced AI development more accessible to developers, AI researchers and data scientists. Powered by t…",https://www.madshrimps.be/news/asus-announces-availability-of-asus-ascent-gx10-personal-ai-supercomputer/,2025-10-14T05:42:57Z
"{'id': None, 'name': 'Biztoc.com'}",Publicis Raises Growth Outlook on Strong Ads and AI Demand,,https://biztoc.com/x/ac6721f49c623bc8,2025-10-14T05:42:56Z
"{'id': None, 'name': 'Madshrimps.be'}",GIGABYTE Announces Personal AI Supercomputer AI TOP ATOM Global Availability,"GIGABYTE, the world’s leading computer brand, announces its latest energy-efficient AI supercomputing solution, AI TOP ATOM, will be officially on the market on October 15th. AI TOP ATOM is powered by the NVIDIA Grace Blackwell GB10 Superchip, designed for on…",https://www.madshrimps.be/news/gigabyte-announces-personal-ai-supercomputer-ai-top-atom-global-availability/,2025-10-14T05:42:49Z
"{'id': None, 'name': 'Biztoc.com'}","France's Publicis says AI drives its growth, raises yearly forecast again",,https://biztoc.com/x/57f0ec01e6a305a7,2025-10-14T05:42:48Z
"{'id': None, 'name': 'Madshrimps.be'}",Microsoft debuts its first in-house AI image generator,"Microsoft is continuing to roll out in-house AI models, further decreasing its reliance on long-standing partnership with OpenAI. Today, the company introduced MAI-Image-1, its first internally-developed image-generating AI model. According to the blog post, …",https://www.madshrimps.be/news/microsoft-debuts-its-first-in-house-ai-image-generator/,2025-10-14T05:42:14Z
"{'id': None, 'name': 'Madshrimps.be'}",Descript’s AI Video Editing Tools Will Save You Time,"Anyone who has edited audio or video in the past knows one thing for sure—the process is long and tedious, oftentimes longer than you ever expected. https://www.howtogeek.com/descript-ai-video-editing-tool/",https://www.madshrimps.be/news/descripts-ai-video-editing-tools-will-save-you-time/,2025-10-14T05:41:54Z
"{'id': None, 'name': 'Pypi.org'}",superagentx 0.1.18.17,The Ultimate Modular Autonomous Multi AI Agent Framework.,https://pypi.org/project/superagentx/0.1.18.17/,2025-10-14T05:40:27Z
"{'id': None, 'name': 'Pypi.org'}",smart-git-ai 0.1.5,AI-powered git commit message generator and git utility toolkit,https://pypi.org/project/smart-git-ai/0.1.5/,2025-10-14T05:38:43Z
"{'id': None, 'name': 'Madshrimps.be'}","Google’s Nano Banana AI-image editing is coming to Search, NotebookLM and Photos","Google's Nano Banana AI image editor became something of a viral sensation when it launched last month. Now the tool is being integrated into a bunch of pre-existing Google products, like Search, NotebookLM and Photos. https://www.engadget.com/ai/googles-nano…",https://www.madshrimps.be/news/googles-nano-banana-ai-image-editing-is-coming-to-search-notebooklm-and-photos/,2025-10-14T05:37:04Z
"{'id': None, 'name': 'Madshrimps.be'}",Giga Computing Joins OCP Global Summit and Debuts New OCP-based GIGABYTE Server,"Giga Computing, a subsidiary of GIGABYTE and an industry leader in enterprise hardware and advanced cooling solutions, today announced its participation in the OCP Global Summit and the launch of its new GIGABYTE TO86-SD1 based on the NVIDIA HGX B200 platform…",https://www.madshrimps.be/news/giga-computing-joins-ocp-global-summit-and-debuts-new-ocp-based-gigabyte-server/,2025-10-14T05:36:38Z
"{'id': None, 'name': 'Madshrimps.be'}",NVIDIA Spectrum-X Ethernet Switches Speed Up Networks for Meta and Oracle,"NVIDIA today announced that Meta and Oracle will boost their AI data center networks with NVIDIA Spectrum-X Ethernet networking switches. Meta and Oracle are standardizing on Spectrum-X Ethernet switches as an open, accelerated networking architecture that sp…",https://www.madshrimps.be/news/nvidia-spectrum-x-ethernet-switches-speed-up-networks-for-meta-and-oracle/,2025-10-14T05:36:09Z
"{'id': None, 'name': 'Notebookcheck.net'}",Orange Pi 4 Pro launches as Raspberry Pi 5 alternative with up to 16GB LPDDR5 and HDMI 2.0,"The Orange Pi 4 Pro is a new single-board computer, making it a direct alternative to the Raspberry Pi 5. The model sports an NPU and can accelerate AI applications locally, although its performance is not particularly high by current standards.",https://www.notebookcheck.net/Orange-Pi-4-Pro-launches-as-Raspberry-Pi-5-alternative-with-up-to-16GB-LPDDR5-and-HDMI-2-0.1138015.0.html,2025-10-14T05:36:00Z
"{'id': None, 'name': 'Madshrimps.be'}",NVIDIA Moves to 800 Volt DC Power Infrastructure to Drive Gigawatt-Scale AI,"NVIDIA is implementing a major change in data center power architecture by using 800-volt DC distribution as the practical foundation for next-generation AI systems. Presented at the 2025 OCP Global Summit, the company’s specifications and partner commitments…",https://www.madshrimps.be/news/nvidia-moves-to-800-volt-dc-power-infrastructure-to-drive-gigawatt-scale-ai/,2025-10-14T05:35:42Z
"{'id': None, 'name': 'ComingSoon.net'}",The Neighborhood Showrunners Hint at How CBS Comedy Series Will End,"CBS’ long-running comedy The Neighborhood enters its eighth and final season, signaling an emotional ending with major changes ahead. The new chapter explores how life on the block evolves as familiar faces experience new beginnings and personal transitions. …",https://www.comingsoon.net/tv/news/2042370-the-neighborhood-finale-ending-season-8-teased-showrunners,2025-10-14T05:34:15Z
