source,title,description,url,publishedAt
"{'id': None, 'name': 'Forrester.com'}",Accelerating Formula 1 Innovation with AWS and AI-Native Cloud,"In Formula 1, speed is measured not just in lap times but in how quickly teams, engineers, and fans can interpret and act on data. Every millisecond counts, making rapid decision-making essential. At the recent Singapore Grand Prix, we observed AWS’s FastTrac…",https://www.forrester.com/blogs/accelerating-formula-1-innovation-with-aws-and-ai-native-cloud/,2025-10-14T05:33:02Z
"{'id': None, 'name': 'ZDNet'}",CIOの約4割が意思決定でCEOとの認識のズレを実感--ネットスコープ調査,Netskope Japanは、グローバル調査レポート「Crucial Conversations: How to Achieve CIO-CEO Alignment in the Era of AI（AI時代におけるCIOとCEO連携の実現に向けて）」の結果を発表した。,https://japan.zdnet.com/article/35239178/,2025-10-14T05:33:00Z
"{'id': None, 'name': 'Yahoo Entertainment'}",Undiscovered Gems In Europe Featuring 3 Promising Small Caps,"As European markets face headwinds from political turmoil and trade tensions, the pan-European STOXX Europe 600 Index has recently seen a decline following...",https://finance.yahoo.com/news/undiscovered-gems-europe-featuring-3-053256273.html,2025-10-14T05:32:56Z
"{'id': None, 'name': 'CNA'}","France's Publicis says AI drives its growth, raises yearly forecast again","French advertising firm Publicis on Monday raised its full-year organic growth forecast for the second time, highlighting artificial intelligence products as its main growth driver. ""It is artificial intelligence that allows us to accelerate our clients' grow…",https://www.channelnewsasia.com/business/frances-publicis-says-ai-drives-its-growth-raises-yearly-forecast-again-5400451,2025-10-14T05:31:54Z
"{'id': None, 'name': 'Pypi.org'}",orq-ai-sdk 3.14.0rc23,Python Client SDK for the Orq API.,https://pypi.org/project/orq-ai-sdk/3.14.0rc23/,2025-10-14T05:30:53Z
"{'id': None, 'name': 'Newsshooter'}",Bastille Day captured with the Blackmagic Design URSA Cine Immersive,"Bastille Day is one of France’s most recognizable national events, combining military parades, aerial flyovers, and state ceremonies watched around the world. For the first time, it was captured as an immersive film, allowing viewers to experience the celebra…",https://www.newsshooter.com/2025/10/13/bastille-day-captured-with-the-blackmagic-design-ursa-cine-immersive/,2025-10-14T05:30:26Z
"{'id': None, 'name': 'GlobeNewswire'}",Publicis Groupe : Third Quarter 2025 Revenue,"N     Very strong Q3 at +5.7% organic growth      Further guidance upgrade on strength of client demand for AI products and services        October 14,......",https://www.globenewswire.com/news-release/2025/10/14/3165873/0/en/Publicis-Groupe-Third-Quarter-2025-Revenue.html,2025-10-14T05:30:00Z
"{'id': None, 'name': 'Adweek'}",Arthur Sadoun Says AI Shift Doesn’t Need to be Ad Industry’s ‘Kodak Moment’,CEO says 73% of Publicis' operating model is now 'AI-powered.',https://www.adweek.com/agencies/arthur-sadoun-says-ai-shift-doesnt-need-to-be-ad-industrys-kodak-moment/,2025-10-14T05:30:00Z
"{'id': None, 'name': 'Pypi.org'}",topologicpy 0.8.73,"An AI-Powered Spatial Modelling and Analysis Software Library for Architecture, Engineering, and Construction.",https://pypi.org/project/topologicpy/0.8.73/,2025-10-14T05:23:21Z
"{'id': None, 'name': 'Android Headlines'}",5 Proven Ways AI Tools Help Teams Boost Productivity in 2025,"Why Teams Feel Busy—and How AI Starts to Fix It If your days feel like a blur of pings, meetings, and half-finished notes, you’re not alone. Ironically,",https://www.androidheadlines.com/2025/10/5-proven-ways-ai-tools-help-teams-boost-productivity-in-2025.html,2025-10-14T05:23:00Z
"{'id': None, 'name': 'GlobeNewswire'}",Moomoo now Australia’s most downloaded trading app,Moomoo has overtaken competitors to become Australia's most downloaded trading app in 2025.......,https://www.globenewswire.com/news-release/2025/10/14/3165872/0/en/Moomoo-now-Australia-s-most-downloaded-trading-app.html,2025-10-14T05:22:00Z
"{'id': None, 'name': 'Pypi.org'}",pai-browser-use 0.1.3,Pydantic AI Toolsets for browser use,https://pypi.org/project/pai-browser-use/0.1.3/,2025-10-14T05:20:38Z
"{'id': None, 'name': 'Insurance Journal'}",Apple Sued Over Use of Copyrighted Books to Train Apple Intelligence,Apple was hit with a lawsuit in California federal court by a pair of neuroscientists who say that the tech company misused thousands of copyrighted books to train its Apple Intelligence artificial intelligence model. Susana Martinez-Conde and Stephen Macknik…,https://www.insurancejournal.com/news/national/2025/10/14/843454.htm,2025-10-14T05:14:33Z
"{'id': None, 'name': 'Pypi.org'}",slide-lye 2.2.3,Lye - Tools package for Tyler AI framework,https://pypi.org/project/slide-lye/2.2.3/,2025-10-14T05:12:19Z
"{'id': None, 'name': 'Pypi.org'}",slide-space-monkey 2.2.3,"A simple, powerful way to deploy Tyler AI agents as Slack agents",https://pypi.org/project/slide-space-monkey/2.2.3/,2025-10-14T05:12:17Z
"{'id': None, 'name': 'Pypi.org'}",slide-narrator 2.2.3,Thread and file storage components for conversational AI - the companion to Tyler AI framework,https://pypi.org/project/slide-narrator/2.2.3/,2025-10-14T05:12:15Z
"{'id': None, 'name': 'Pypi.org'}",slide-tyler 2.2.3,Tyler: A development kit for manifesting AI agents with a complete lack of conventional limitations,https://pypi.org/project/slide-tyler/2.2.3/,2025-10-14T05:12:12Z
"{'id': None, 'name': 'New Zealand Herald'}",NZ sharemarket down 0.5% amid PGW shuffle - Market close,"The S&P/NZX 50 Index closed at 13,276.99, down 74.93 points or 0.56%.",https://www.nzherald.co.nz/business/markets/shares/nz-sharemarket-down-05-amid-pgw-shuffle-market-close/MZNJS3H6WZE55CC3CLTEBZIR6E/,2025-10-14T05:11:37Z
"{'id': None, 'name': 'Stanford.edu'}",Stanford Law rolls out liftlab to rethink AI’s role in the legal profession,"Nyarko said, “The legal profession has not just an opportunity, but an obligation, to do more than just boost efficiency. We want to understand how technology can surface the expertise […]",https://law.stanford.edu/press/stanford-law-rolls-out-liftlab-to-rethink-ais-role-in-the-legal-profession/,2025-10-14T05:10:59Z
"{'id': None, 'name': 'The Star Online'}",Europe fights for AI independence to avoid becoming tech ‘colony’,"In June, French president Emmanuel Macron held an exclusive dinner at the Élysée Palace with a special guest: Nvidia's Jensen Huang. Wine glasses clinked in honour of a deal his company had just unveiled with Mistral, the leading French artificial intelligenc…",https://www.thestar.com.my/tech/tech-news/2025/10/14/europe-fights-for-ai-independence-to-avoid-becoming-tech-colony,2025-10-14T05:10:00Z
"{'id': None, 'name': 'Biztoc.com'}","UK Lacks Growth Funding for Critical Sectors Like Quantum, AI",,https://biztoc.com/x/cd570a2b19cc25f1,2025-10-14T05:09:47Z
"{'id': None, 'name': 'SamMobile'}",Samsung rides the AI boom to post highest profit in three years,"Samsung has revealed its earnings guidance for the third quarter (Q3) of this year. After missing out on the AI boom over the past two years, the company appears ready to capitalize on it. It expects to post its highest Q3 profit in the past three years, as i…",https://www.sammobile.com/news/samsung-rides-ai-boom-q3-2025-highest-profit-three-years/,2025-10-14T05:09:43Z
"{'id': None, 'name': 'Pypi.org'}",pai-browser-use 0.1.2,Pydantic AI Toolsets for browser use,https://pypi.org/project/pai-browser-use/0.1.2/,2025-10-14T05:08:48Z
"{'id': None, 'name': 'Insurance Journal'}",AI’s Growth Leaves Financial Regulators Struggling to Catch Up,"Regulators are still at an “early stage” in their efforts to track the risks posed to the financial system by the rapid adoption of artificial intelligence, global financial watchdogs warned on Oct 10. In a report to the G20, the …",https://www.insurancejournal.com/news/national/2025/10/14/843483.htm,2025-10-14T05:08:19Z
"{'id': None, 'name': 'Forbes'}",23rd Forbes Global CEO Conference Opens In Jakarta,"Prabowo Subianto, President of the Republic of Indonesia, leads a distinguished speaker line-up for the 23rd Forbes Global CEO Conference",https://www.forbes.com/sites/forbespr/2025/10/14/23rd-forbes-global-ceo-conference-opens-in-jakarta/,2025-10-14T05:05:59Z
"{'id': None, 'name': 'Pypi.org'}",nedo-vision-training 1.2.0,A comprehensive training service library for AI models in the Nedo Vision platform,https://pypi.org/project/nedo-vision-training/1.2.0/,2025-10-14T05:05:05Z
"{'id': None, 'name': 'Wolfram.com'}",How Alpha Spy Nest Rescued My Life Savings from a Deceptive WhatsApp Trading Scam,"I was at my lowest, scammed out of $15,000 my life savings by a WhatsApp group promising sky-high returns on a crypto trading platform. It started innocently: a friendly stranger added me to a group chat, filled with investors sharing screenshots of massive p…",https://community.wolfram.com/groups/-/m/t/3560191,2025-10-14T05:05:01Z
"{'id': None, 'name': 'Pypi.org'}",smart-git-ai 0.1.4,AI-powered git commit message generator and git utility toolkit,https://pypi.org/project/smart-git-ai/0.1.4/,2025-10-14T05:03:31Z
"{'id': None, 'name': 'Pypi.org'}",pai-browser-use 0.1.1,Pydantic AI Toolsets for browser use,https://pypi.org/project/pai-browser-use/0.1.1/,2025-10-14T05:02:44Z
"{'id': 'financial-post', 'name': 'Financial Post'}","The Estée Lauder Companies Opens Global Fragrance Atelier in Paris, Accelerating Next-Generation Innovation in Perfume Artistry","PARIS — The Estée Lauder Companies Inc. (NYSE:EL), under the High Patronage of Mr. Emmanuel Macron, President of the French Republic, today announced the opening of its Fragrance Atelier within its new La Maison des Parfums on Rue Volney in Paris. This newly …",https://financialpost.com/pmn/business-wire-news-releases-pmn/the-estee-lauder-companies-opens-global-fragrance-atelier-in-paris-accelerating-next-generation-innovation-in-perfume-artistry,2025-10-14T05:01:10Z
"{'id': None, 'name': 'Kernel.org'}",The eighteenth batch,,https://git.kernel.org/pub/scm/git/git.git/commit/?id=ac7d021f0659f5a81be7b69a54a19c9618ce9dba,2025-10-14T05:00:35Z
"{'id': None, 'name': 'Kernel.org'}",Merge branch 'ps/ci-avoid-broken-sudo-on-ubuntu',,https://git.kernel.org/pub/scm/git/git.git/commit/?id=7ac17316205e8313948a94379ce185065517d87d,2025-10-14T05:00:35Z
"{'id': None, 'name': 'Kernel.org'}",Merge branch 'ps/commit-graph-per-object-source',,https://git.kernel.org/pub/scm/git/git.git/commit/?id=47c3e03034dbde74874406d1155e46f86d6bd859,2025-10-14T05:00:35Z
